{
  "run_id": "run-20260216-36027c",
  "created_at": "2026-02-16T13:47:16.176683+00:00",
  "completed_at": "2026-02-16T13:47:46.189879+00:00",
  "status": "failed",
  "tasks": [
    {
      "task_id": "TKT-0010",
      "owner_agent": "codex",
      "status": "timeout",
      "exit_code": "X-001"
    }
  ],
  "config_hash": "sha256:c78f7bb9d769c39cd2ff6e8c444caf54dd7712e1443fad845ff4dd075db3cdcb",
  "system_rules_hash": "sha256:f6658ee60538655574d54eea0bdeceae5c450c08b0c890e74f7f9d91b41fb6cc",
  "aggregate_metrics": {
    "total_tasks": 1,
    "succeeded": 0,
    "failed": 1,
    "total_duration_seconds": 30.013196,
    "total_tokens": 0,
    "retry_total": 0,
    "conflict_count": 0
  }
}
