{
  "run_id": "run-20260216-bac8f8",
  "created_at": "2026-02-16T13:38:22.197958+00:00",
  "completed_at": "2026-02-16T13:38:52.213625+00:00",
  "status": "failed",
  "tasks": [
    {
      "task_id": "TKT-0006",
      "owner_agent": "codex",
      "status": "timeout",
      "exit_code": "X-001"
    }
  ],
  "config_hash": "sha256:548da545fc442edeed66dc14e7f6693540861e25c787200a3b58c619114debe9",
  "system_rules_hash": "sha256:f6658ee60538655574d54eea0bdeceae5c450c08b0c890e74f7f9d91b41fb6cc",
  "aggregate_metrics": {
    "total_tasks": 1,
    "succeeded": 0,
    "failed": 1,
    "total_duration_seconds": 30.015667,
    "total_tokens": 0,
    "retry_total": 0,
    "conflict_count": 0
  }
}
