{
  "run_id": "run-20260216-27f61b",
  "created_at": "2026-02-16T13:32:57.938111+00:00",
  "completed_at": "2026-02-16T13:33:27.958713+00:00",
  "status": "failed",
  "tasks": [
    {
      "task_id": "TKT-0003",
      "owner_agent": "codex",
      "status": "timeout",
      "exit_code": "X-001"
    }
  ],
  "config_hash": "sha256:1e2d1dcd46db081a6ad71643b5a73c1f530b038971158f2b32f5bc02af25a05e",
  "system_rules_hash": "sha256:f6658ee60538655574d54eea0bdeceae5c450c08b0c890e74f7f9d91b41fb6cc",
  "aggregate_metrics": {
    "total_tasks": 1,
    "succeeded": 0,
    "failed": 1,
    "total_duration_seconds": 30.020602,
    "total_tokens": 0,
    "retry_total": 0,
    "conflict_count": 0
  }
}
