{
  "run_id": "run-20260216-eb1036",
  "created_at": "2026-02-16T13:37:02.099549+00:00",
  "completed_at": "2026-02-16T13:37:32.117323+00:00",
  "status": "failed",
  "tasks": [
    {
      "task_id": "TKT-0005",
      "owner_agent": "codex",
      "status": "timeout",
      "exit_code": "X-001"
    }
  ],
  "config_hash": "sha256:6a0b18bf9a0421eba2b9a7be3905973cf47760339c390a6561139e5664021c52",
  "system_rules_hash": "sha256:f6658ee60538655574d54eea0bdeceae5c450c08b0c890e74f7f9d91b41fb6cc",
  "aggregate_metrics": {
    "total_tasks": 1,
    "succeeded": 0,
    "failed": 1,
    "total_duration_seconds": 30.017774,
    "total_tokens": 0,
    "retry_total": 0,
    "conflict_count": 0
  }
}
