{
  "run_id": "run-20260216-5a2fec",
  "created_at": "2026-02-16T13:39:23.115778+00:00",
  "completed_at": "2026-02-16T13:39:53.131793+00:00",
  "status": "failed",
  "tasks": [
    {
      "task_id": "TKT-0008",
      "owner_agent": "codex",
      "status": "timeout",
      "exit_code": "X-001"
    }
  ],
  "config_hash": "sha256:66c099cb26e726172166bce880fcb243d9cb87111e5409d0b773939a1af2c2e6",
  "system_rules_hash": "sha256:f6658ee60538655574d54eea0bdeceae5c450c08b0c890e74f7f9d91b41fb6cc",
  "aggregate_metrics": {
    "total_tasks": 1,
    "succeeded": 0,
    "failed": 1,
    "total_duration_seconds": 30.016015,
    "total_tokens": 0,
    "retry_total": 0,
    "conflict_count": 0
  }
}
