{
  "run_id": "run-20260216-1c5484",
  "created_at": "2026-02-16T13:46:30.556795+00:00",
  "completed_at": "2026-02-16T13:47:00.589694+00:00",
  "status": "failed",
  "tasks": [
    {
      "task_id": "TKT-0009",
      "owner_agent": "codex",
      "status": "timeout",
      "exit_code": "X-001"
    }
  ],
  "config_hash": "sha256:dc431a7c59e9eac44616ec28093ab164db4cfd4a0358436053c2f00326d154dd",
  "system_rules_hash": "sha256:f6658ee60538655574d54eea0bdeceae5c450c08b0c890e74f7f9d91b41fb6cc",
  "aggregate_metrics": {
    "total_tasks": 1,
    "succeeded": 0,
    "failed": 1,
    "total_duration_seconds": 30.032899,
    "total_tokens": 0,
    "retry_total": 0,
    "conflict_count": 0
  }
}
